{
  "schemaVersion": 1,
  "taskId": "task-localize-482-520",
  "runId": "run-team-001",
  "afterCursor": "cursor-100",
  "nextCursor": "cursor-106",
  "hasMore": false,
  "events": [
    {
      "id": "event-101",
      "cursor": "cursor-101",
      "seq": 101,
      "taskId": "task-localize-482-520",
      "runId": "run-team-001",
      "agentThreadId": "thread-main",
      "type": "run_upsert",
      "occurredAt": "2026-07-10T09:41:00.000Z",
      "run": {
        "id": "run-team-001",
        "taskId": "task-localize-482-520",
        "mode": "team",
        "status": "active",
        "rootAgentThreadId": "thread-main",
        "planHash": "plan-sha256-fixture",
        "estimatedCalls": 4,
        "modelRoutes": {
          "producer": "deepseek/deepseek-v4-flash",
          "editor": "deepseek/deepseek-v4-flash"
        },
        "startedAt": "2026-07-10T09:41:00.000Z",
        "updatedAt": "2026-07-10T09:41:00.000Z",
        "completedAt": null,
        "stopAvailable": true,
        "resumeAvailable": false,
        "usage": {
          "inputTokens": 0,
          "outputTokens": 0,
          "totalTokens": 0,
          "costUSD": 0,
          "modelCalls": 0
        }
      }
    },
    {
      "id": "event-102",
      "cursor": "cursor-102",
      "seq": 102,
      "taskId": "task-localize-482-520",
      "runId": "run-team-001",
      "agentThreadId": "thread-editor",
      "type": "thread_upsert",
      "occurredAt": "2026-07-10T09:42:00.000Z",
      "thread": {
        "id": "thread-editor",
        "taskId": "task-localize-482-520",
        "runId": "run-team-001",
        "parentThreadId": "thread-main",
        "identity": {
          "kind": "specialist",
          "roleId": "editor",
          "displayName": "Editor",
          "roleLabel": "语言与一致性审校",
          "disclosureLabel": "Agent"
        },
        "status": "active",
        "canReceiveUserMessage": true,
        "handoffSummary": "审校 Translator 候选，核对角色语气、TM 与术语一致性。",
        "latestActivityId": "activity-editor-ack",
        "childThreadIds": [],
        "createdAt": "2026-07-10T09:42:00.000Z",
        "updatedAt": "2026-07-10T09:42:02.000Z"
      }
    },
    {
      "id": "event-103",
      "cursor": "cursor-103",
      "seq": 103,
      "taskId": "task-localize-482-520",
      "runId": "run-team-001",
      "agentThreadId": "thread-editor",
      "type": "activity_append",
      "occurredAt": "2026-07-10T09:42:02.000Z",
      "activity": {
        "id": "activity-editor-ack",
        "taskId": "task-localize-482-520",
        "runId": "run-team-001",
        "agentThreadId": "thread-editor",
        "seq": 1,
        "type": "acknowledgement",
        "status": "done",
        "actor": {
          "kind": "agent",
          "id": "editor",
          "displayName": "Editor",
          "agentThreadId": "thread-editor"
        },
        "title": "已接收审校任务",
        "body": "我会核对候选、证据与机械约束，然后提交可审阅产物。",
        "tool": null,
        "refs": {
          "artifactIds": [],
          "evidenceRefs": [],
          "decisionIds": []
        },
        "createdAt": "2026-07-10T09:42:02.000Z",
        "updatedAt": "2026-07-10T09:42:02.000Z"
      }
    },
    {
      "id": "event-104",
      "cursor": "cursor-104",
      "seq": 104,
      "taskId": "task-localize-482-520",
      "runId": "run-team-001",
      "agentThreadId": "thread-editor",
      "type": "artifact_upsert",
      "occurredAt": "2026-07-10T09:45:30.000Z",
      "artifact": {
        "id": "artifact-segment-487-v1",
        "taskId": "task-localize-482-520",
        "runId": "run-team-001",
        "type": "segment_proposal",
        "status": "reviewable",
        "title": "候选译文 · 段 487",
        "summary": "Editor 建议将 secrets 改为单数 secret。",
        "scope": {
          "projectId": "project-stellar-legend",
          "batchId": "batch-story-07",
          "segmentIds": [
            "487"
          ],
          "sourceLocale": "zh-CN",
          "targetLocale": "en-US"
        },
        "version": 1,
        "provenance": {
          "agentThreadId": "thread-editor",
          "activityId": "activity-editor-artifact",
          "evidenceRefs": [
            "tm:TM_4521",
            "term:moon",
            "term:secret",
            "qa:segment-487"
          ],
          "parentArtifactIds": []
        },
        "availableDecisions": [
          "approve",
          "reject",
          "request_change",
          "apply"
        ],
        "content": {
          "segmentId": "487",
          "source": "今晚，月亮会替我保守秘密。",
          "currentTarget": "Tonight, the moon will keep my secrets.",
          "candidateTarget": "Tonight, the moon will keep my secret."
        },
        "createdAt": "2026-07-10T09:45:30.000Z",
        "updatedAt": "2026-07-10T09:45:30.000Z"
      }
    },
    {
      "id": "event-105",
      "cursor": "cursor-105",
      "seq": 105,
      "taskId": "task-localize-482-520",
      "runId": "run-team-001",
      "agentThreadId": "thread-editor",
      "type": "decision_upsert",
      "occurredAt": "2026-07-10T09:45:30.000Z",
      "decision": {
        "id": "decision-review-487",
        "taskId": "task-localize-482-520",
        "runId": "run-team-001",
        "requestedByThreadId": "thread-editor",
        "artifactId": "artifact-segment-487-v1",
        "kind": "proposal_review",
        "status": "required",
        "prompt": "是否接受 Editor 对段 487 的候选译文？",
        "options": [
          {
            "id": "accept",
            "label": "接受",
            "action": "approve",
            "destructive": false
          },
          {
            "id": "change",
            "label": "请求修改",
            "action": "request_change",
            "destructive": false
          }
        ],
        "selectedOptionId": null,
        "reason": null,
        "scope": {
          "projectId": "project-stellar-legend",
          "batchId": "batch-story-07",
          "segmentIds": [
            "487"
          ],
          "sourceLocale": "zh-CN",
          "targetLocale": "en-US"
        },
        "createdAt": "2026-07-10T09:45:30.000Z",
        "decidedAt": null
      }
    },
    {
      "id": "event-106",
      "cursor": "cursor-106",
      "seq": 106,
      "taskId": "task-localize-482-520",
      "runId": "run-team-001",
      "agentThreadId": "thread-editor",
      "type": "usage_update",
      "occurredAt": "2026-07-10T09:45:30.000Z",
      "usage": {
        "inputTokens": 4120,
        "outputTokens": 780,
        "cacheReadTokens": 1200,
        "cacheWriteTokens": 0,
        "totalTokens": 6100,
        "costUSD": 0.0184,
        "modelCalls": 2
      }
    }
  ]
}
